review_asli,review_clean,review_normalized,rating,label,tanggal
makin lama makin aneh ni shopee barang saya sudah seminggu lebih belum di kirim²,makin lama makin aneh ni shopee barang saya sudah seminggu lebih belum di kirim,makin lama makin aneh ni shopee barang saya sudah seminggu lebih belum di kirim,2,Negatif,2026-04-14 00:33:50
paling the best,paling the best,paling the best,5,Positif,2026-04-14 00:30:58
sangat bagus,sangat bagus,sangat bagus,5,Positif,2026-04-14 00:29:46
"kurang recomended terutama dari kurirnya SPX lelet banget, ngirim paket berasa ngirim antar benua lama amat nyampeknya, saya sarankan mnding beralih ke toko lainnya, SAYA SANGAT KECEWAAAA",kurang recomended terutama dari kurirnya spx lelet banget ngirim paket berasa ngirim antar benua lama amat nyampeknya saya sarankan mnding beralih ke toko lainnya saya sangat kecewaaaa,kurang recomended terutama dari kurirnya spx lelet banget ngirim paket berasa ngirim antar benua lama amat nyampeknya saya sarankan mnding beralih ke toko lainnya saya sangat kecewaaaa,1,Negatif,2026-04-14 00:27:02
"kalau banned akun itu sistem yang bener . gua udah berlangganan mahal2 main ban aja. iya kalau gua kriminal dan penipu pantas Lo ban. pengajuan kaya formalitas aja , robot lu aja yang respon. kalau kaya gini gak ada solusi atau pertanggung jawaban. semakin semena-mena aja ni aplikasi 👎👎👎👎",kalau banned akun itu sistem yang bener gua udah berlangganan mahal main ban aja iya kalau gua kriminal dan penipu pantas lo ban pengajuan kaya formalitas aja robot lu aja yang respon kalau kaya gini gak ada solusi atau pertanggung jawaban semakin semena mena aja ni aplikasi,kalau banned akun itu sistem yang bener gua sudah berlangganan mahal main ban saja iya kalau gua kriminal dan penipu pantas lo ban pengajuan kaya formalitas saja robot lu saja yang respon kalau kaya gini tidak ada solusi atau pertanggung jawaban semakin semena mena saja ni aplikasi,1,Negatif,2026-04-14 00:24:18
terbaik,terbaik,terbaik,5,Positif,2026-04-14 00:20:33
"bagus,tapi kenapa sering minta perbarui akun.",bagus tapi kenapa sering minta perbarui akun,bagus tapi kenapa sering minta perbarui akun,4,Positif,2026-04-14 00:18:59
belum pernah d kecewakan upgred terus biar semakin meningkat aplikasinya,belum pernah d kecewakan upgred terus biar semakin meningkat aplikasinya,belum pernah d kecewakan upgred terus biar semakin meningkat aplikasinya,5,Positif,2026-04-14 00:18:15
Aplikasi banyak Discoun barang kata nya datang 1 minggu... tapi belum 1 minggu aja udah sampe,aplikasi banyak discoun barang kata nya datang minggu tapi belum minggu aja udah sampe,aplikasi banyak discoun barang kata nya datang minggu tapi belum minggu saja sudah sampe,5,Positif,2026-04-14 00:14:45
"bagus sekali,pelayanannya bagus dan cepat",bagus sekali pelayanannya bagus dan cepat,bagus sekali pelayanannya bagus dan cepat,5,Positif,2026-04-14 00:14:43
SDH lama pake shopee di tingkatkan dan di pertahankan yaa...,sdh lama pake shopee di tingkatkan dan di pertahankan yaa,sudah lama pake shopee di tingkatkan dan di pertahankan yaa,5,Positif,2026-04-14 00:13:16
selalu bermanfaat dan semoga sering banyak dicount 🔥🔥🔥🔥,selalu bermanfaat dan semoga sering banyak dicount,selalu bermanfaat dan semoga sering banyak dicount,5,Positif,2026-04-14 00:12:12
semoga bisa,semoga bisa,semoga bisa,5,Positif,2026-04-14 00:10:31
bagus,bagus,bagus,5,Positif,2026-04-14 00:10:10
spaylater mentok di 300 ribuan gak naik2.. ongkir kena mahal. mending uninstall saja ini aplikasi.,spaylater mentok di ribuan gak naik ongkir kena mahal mending uninstall saja ini aplikasi,spaylater mentok di ribuan tidak naik ongkos kirim kena mahal mending uninstall saja ini aplikasi,1,Negatif,2026-04-14 00:09:11
shoppe memang rajanya online termurah,shoppe memang rajanya online termurah,shoppe memang rajanya online termurah,5,Positif,2026-04-14 00:08:17
bagus sekali,bagus sekali,bagus sekali,5,Positif,2026-04-14 00:05:15
"Shopee sangat baik , gratis ongkir ok",shopee sangat baik gratis ongkir ok,shopee sangat baik gratis ongkos kirim ok,5,Positif,2026-04-14 00:03:22
suka,suka,suka,5,Positif,2026-04-13 23:56:36
saya suka sekali,saya suka sekali,saya suka sekali,5,Positif,2026-04-13 23:56:08
ribet g bagus pengembalian barang aja ribet pakai ditinjau segalah lagi kan namanya bebas pengembalian y bebas dong ni pakai ditinju lagi pokok nya ribet di shopee nyesel langganan di shopee.,ribet g bagus pengembalian barang aja ribet pakai ditinjau segalah lagi kan namanya bebas pengembalian y bebas dong ni pakai ditinju lagi pokok nya ribet di shopee nyesel langganan di shopee,rumit/tidak praktis tidak bagus pengembalian barang saja rumit/tidak praktis pakai ditinjau segalah lagi kan namanya bebas pengembalian y bebas saja (partikel penegas) ni pakai ditinju lagi pokok nya rumit/tidak praktis di shopee nyesel langganan di shopee,1,Negatif,2026-04-13 23:52:50
bagus,bagus,bagus,5,Positif,2026-04-13 23:48:33
puas banget,puas banget,puas banget,5,Positif,2026-04-13 23:43:44
bagus banget,bagus banget,bagus banget,4,Positif,2026-04-13 23:42:43
"mantab, cepat dan lancar",mantab cepat dan lancar,mantab cepat dan lancar,5,Positif,2026-04-13 23:42:29
bagus bangetttt,bagus bangetttt,bagus bangetttt,5,Positif,2026-04-13 23:39:43
puas,puas,puas,5,Positif,2026-04-13 23:35:24
banyak menggangu di iklan susah di pencet banyak ngatur,banyak menggangu di iklan susah di pencet banyak ngatur,banyak menggangu di iklan susah di pencet banyak ngatur,1,Negatif,2026-04-13 23:31:50
Banyak barang yang tidak sesuai,banyak barang yang tidak sesuai,banyak barang yang tidak sesuai,4,Positif,2026-04-13 23:31:12
"apalah setiap ada iklan nya sengaja banget buat di arahin paksa ke aplikasi nya,mana banyak jebakan contoh,tombol x palsu,ga ada mencet langsung ke aplikasi nya,bodoh.",apalah setiap ada iklan nya sengaja banget buat di arahin paksa ke aplikasi nya mana banyak jebakan contoh tombol x palsu ga ada mencet langsung ke aplikasi nya bodoh,apalah setiap ada iklan nya sengaja banget untuk di arahin paksa ke aplikasi nya mana banyak jebakan contoh tombol x palsu tidak ada mencet langsung ke aplikasi nya bodoh,1,Negatif,2026-04-13 23:29:53
"Update terus,,, tapi Loading ttp lama. Padahal Jaringan bagus, Memory hp besar.. Aplikasi sebelah bagus, lancar gak ada masalah..",update terus tapi loading ttp lama padahal jaringan bagus memory hp besar aplikasi sebelah bagus lancar gak ada masalah,update terus tapi loading ttp lama padahal jaringan bagus memory hp besar aplikasi sebelah bagus lancar tidak ada masalah,1,Negatif,2026-04-13 23:28:15
Baik,baik,baik,5,Positif,2026-04-13 23:24:53
ok,ok,ok,5,Positif,2026-04-13 23:24:09
sejauh ini puas dgn layanannya,sejauh ini puas dgn layanannya,sejauh ini puas dengan layanannya,5,Positif,2026-04-13 23:23:59
sangat membantu untuk usaha saya mencari barang yg relatif murah,sangat membantu untuk usaha saya mencari barang yg relatif murah,sangat membantu untuk usaha saya mencari barang yg relatif murah,5,Positif,2026-04-13 23:23:36
sudah beberapa kali beli. sangat cocok,sudah beberapa kali beli sangat cocok,sudah beberapa kali beli sangat cocok,5,Positif,2026-04-13 23:20:28
tempat berbelanja paling peraktis dehh suka banget,tempat berbelanja paling peraktis dehh suka banget,tempat berbelanja paling peraktis dehh suka banget,5,Positif,2026-04-13 23:17:17
bagus dan membantu banget kalo mau jualan,bagus dan membantu banget kalo mau jualan,bagus dan membantu banget kalau mau jualan,5,Positif,2026-04-13 23:16:52
enak apah2 ada semua,enak apah ada semua,enak apah ada semua,5,Positif,2026-04-13 23:14:22
Sangat puas belanja di shopee.. banyak promo Dan ongkir termurah.. gesit dalam pelayanan konsumen,sangat puas belanja di shopee banyak promo dan ongkir termurah gesit dalam pelayanan konsumen,sangat puas belanja di shopee banyak promosi/diskon dan ongkos kirim termurah gesit dalam pelayanan konsumen,5,Positif,2026-04-13 23:12:13
thank u,thank u,thank u,5,Positif,2026-04-13 23:06:53
sejauh ini sangat memuaskan,sejauh ini sangat memuaskan,sejauh ini sangat memuaskan,5,Positif,2026-04-13 23:04:52
sangat bagus,sangat bagus,sangat bagus,5,Positif,2026-04-13 23:03:17
I Like This,i like this,i like this,5,Positif,2026-04-13 23:00:27
"barang sudah diterima,sesuai pesanan",barang sudah diterima sesuai pesanan,barang sudah diterima sesuai pesanan,5,Positif,2026-04-13 23:00:22
"shopee makin kesini malah makin kesana, udah bener kaya dulu pengirimannya banyak opsi, estimasi tiba nya tepat lahh sekarang malah makin ancur ni aplikasi, jasa kurirnya cuma satu, ya iyalah pesanan membludak kurirnya keteteran, at least pesanan konsumen yang kehambat, estimasi tiba di tanggal 12, tapi malah stuck",shopee makin kesini malah makin kesana udah bener kaya dulu pengirimannya banyak opsi estimasi tiba nya tepat lahh sekarang malah makin ancur ni aplikasi jasa kurirnya cuma satu ya iyalah pesanan membludak kurirnya keteteran at least pesanan konsumen yang kehambat estimasi tiba di tanggal tapi malah stuck,shopee makin kesini malah makin kesana sudah bener kaya dulu pengirimannya banyak opsi estimasi tiba nya tepat lahh sekarang malah makin ancur ni aplikasi jasa kurirnya cuma satu ya iyalah pesanan membludak kurirnya keteteran at least pesanan konsumen yang kehambat estimasi tiba di tanggal tapi malah stuck,1,Negatif,2026-04-13 22:59:47
"Baru kali ini belanja di Shopee banyak kendalanya, pesanan ku stuck di gudang Bekasi, saya pesen tanggal 5 April dan sampe sekarang 1 minggu lebih belum juga sampai, kayanya masalahnya di ekspedisinya yaitu SPX, tar kalo ada pilihan ekpedisi lain, saya tetep akan belanja di Shopee, tapi tidak akan banyak seperti dulu, karena sudah kecewa sama ekpedisi nya yaitu SPX.. Dan kebanyakan akan pindah ke Aplikasi Belanja Online yang lain, karena kalian pihak Shopee telah membuat saya kecewa..",baru kali ini belanja di shopee banyak kendalanya pesanan ku stuck di gudang bekasi saya pesen tanggal april dan sampe sekarang minggu lebih belum juga sampai kayanya masalahnya di ekspedisinya yaitu spx tar kalo ada pilihan ekpedisi lain saya tetep akan belanja di shopee tapi tidak akan banyak seperti dulu karena sudah kecewa sama ekpedisi nya yaitu spx dan kebanyakan akan pindah ke aplikasi belanja online yang lain karena kalian pihak shopee telah membuat saya kecewa,baru kali ini belanja di shopee banyak kendalanya pesanan ku stuck di gudang bekasi saya pesen tanggal april dan sampe sekarang minggu lebih belum juga sampai kayanya masalahnya di ekspedisinya yaitu spx tar kalau ada pilihan ekpedisi lain saya tetep akan belanja di shopee tapi tidak akan banyak seperti dulu karena sudah kecewa sama ekpedisi nya yaitu spx dan kebanyakan akan pindah ke aplikasi belanja online yang lain karena kalian pihak shopee telah membuat saya kecewa,1,Negatif,2026-04-13 22:58:20
kok paylater ga bisa di buka ya nge bug?,kok paylater ga bisa di buka ya nge bug,kok paylater tidak bisa di buka ya nge kesalahan program,5,Positif,2026-04-13 22:57:24
"sangat baik, memberi rasa aman dalam berbelanja",sangat baik memberi rasa aman dalam berbelanja,sangat baik memberi rasa aman dalam berbelanja,5,Positif,2026-04-13 22:55:09
Lumayan Bagus... Tingkatkan Lagi Ajah Informasih / Lacak Sttus Pengirimanya...,lumayan bagus tingkatkan lagi ajah informasih lacak sttus pengirimanya,lumayan bagus tingkatkan lagi ajah informasih lacak sttus pengirimanya,5,Positif,2026-04-13 22:47:29
belanja jadi mudah dengan Shopee,belanja jadi mudah dengan shopee,belanja jadi mudah dengan shopee,5,Positif,2026-04-13 22:46:24
"Tolong hapus biaya ukuran khusus, sangat tidak masuk akal harganya",tolong hapus biaya ukuran khusus sangat tidak masuk akal harganya,tolong hapus biaya ukuran khusus sangat tidak masuk akal harganya,1,Negatif,2026-04-13 22:34:13
"bingung dengan pengiriman paket nya, kecewa banget dengan shopee. udah 16 hari paket tidak sampai sampai. kemarin di daerah ini besoknya balik lagi ke sortir besoknya lagi beda wilayah lagi aneh aneh shopee",bingung dengan pengiriman paket nya kecewa banget dengan shopee udah hari paket tidak sampai sampai kemarin di daerah ini besoknya balik lagi ke sortir besoknya lagi beda wilayah lagi aneh aneh shopee,bingung dengan pengiriman paket nya kecewa banget dengan shopee sudah hari paket tidak sampai sampai kemarin di daerah ini besoknya balik lagi ke sortir besoknya lagi beda wilayah lagi aneh aneh shopee,1,Negatif,2026-04-13 22:33:40
keren,keren,keren,5,Positif,2026-04-13 22:31:12
"mulai pertama, langsung memainkan video lalu aplikasi sudah di background, tapi masih mengeluarkan suara dari videonya, bagi saya kombinasi ini perlu diubah",mulai pertama langsung memainkan video lalu aplikasi sudah di background tapi masih mengeluarkan suara dari videonya bagi saya kombinasi ini perlu diubah,mulai pertama langsung memainkan video lalu aplikasi sudah di background tapi masih mengeluarkan suara dari videonya bagi saya kombinasi ini perlu diubah,1,Negatif,2026-04-13 22:30:53
shopee slalu bikin happy😇😇😇,shopee slalu bikin happy,shopee slalu bikin happy,5,Positif,2026-04-13 22:30:44
tolong tingkat kan lagi produk nya,tolong tingkat kan lagi produk nya,tolong tingkat kan lagi produk nya,5,Positif,2026-04-13 22:30:43
"shopee paylater udah 3 tahun gak bisa digunain lagi ,gak bisa dipakai ...disuruh nunggu2 gak ada kabar sampai sekarang ...aplikasi buruk",shopee paylater udah tahun gak bisa digunain lagi gak bisa dipakai disuruh nunggu gak ada kabar sampai sekarang aplikasi buruk,shopee paylater sudah tahun tidak bisa digunain lagi tidak bisa dipakai disuruh nunggu tidak ada kabar sampai sekarang aplikasi buruk,1,Negatif,2026-04-13 22:27:25
"Mohon perbaikan!! pada verifikasi wajah, yaitu dengan tablet xiaomi Poco pad M1, mengapa tidak sinkron, jadi ketika posisi tablet dan aplikasi shopee kita posisikan landscape maka kamera yang memunculkan wajah tersebut malah jadi posisi potrait, hingga saya gagal verifikasi!! CATATAN : pada kasus ini, saya pakai aplikasi Shoppe terbaru dan semua izin sudah saya izinkan.",mohon perbaikan pada verifikasi wajah yaitu dengan tablet xiaomi poco pad m mengapa tidak sinkron jadi ketika posisi tablet dan aplikasi shopee kita posisikan landscape maka kamera yang memunculkan wajah tersebut malah jadi posisi potrait hingga saya gagal verifikasi catatan pada kasus ini saya pakai aplikasi shoppe terbaru dan semua izin sudah saya izinkan,mohon perbaikan pada verifikasi wajah yaitu dengan tablet xiaomi poco pad m mengapa tidak sinkron jadi ketika posisi tablet dan aplikasi shopee kita posisikan landscape maka kamera yang memunculkan wajah tersebut malah jadi posisi potrait hingga saya gagal verifikasi catatan pada kasus ini saya pakai aplikasi shoppe terbaru dan semua izin sudah saya izinkan,3,Netral,2026-04-13 22:27:15
belanja online yang mudah,belanja online yang mudah,belanja online yang mudah,5,Positif,2026-04-13 22:24:24
terimakasih,terimakasih,terimakasih,5,Positif,2026-04-13 22:20:32
madepp,madepp,madepp,5,Positif,2026-04-13 22:19:39
good,good,good,5,Positif,2026-04-13 22:16:29
tolong jangan blokir perangkat saya biar saya bisa mesan lagi di shope,tolong jangan blokir perangkat saya biar saya bisa mesan lagi di shope,tolong jangan blokir perangkat saya biar saya bisa mesan lagi di shope,5,Positif,2026-04-13 22:13:16
"Untuk Seller, untuk cek performa toko lebih nyaman aplikasi yg dulu sebelum update. Yg dulu bisa buat lihat produk apa yg paling banyak di kunjungi buyer. Tapi yg sekarang gak ada fitur tersebut. Tolong pihak shopee, buat lagi seperti dulu",untuk seller untuk cek performa toko lebih nyaman aplikasi yg dulu sebelum update yg dulu bisa buat lihat produk apa yg paling banyak di kunjungi buyer tapi yg sekarang gak ada fitur tersebut tolong pihak shopee buat lagi seperti dulu,untuk penjual untuk cek performa toko lebih nyaman aplikasi yg dulu sebelum update yg dulu bisa untuk lihat produk apa yg paling banyak di kunjungi pembeli tapi yg sekarang tidak ada fitur tersebut tolong pihak shopee untuk lagi seperti dulu,4,Positif,2026-04-13 22:13:05
saya sangat suka Shopee.... belanja jd gampang dan amanah skli.,saya sangat suka shopee belanja jd gampang dan amanah skli,saya sangat suka shopee belanja jd gampang dan amanah skli,5,Positif,2026-04-13 22:11:11
selama ini pelayanan shopee baik² saja & apbl ada kendala return barang via Spaylater selalu gerak cepat dan cepet beres prosesnya,selama ini pelayanan shopee baik saja apbl ada kendala return barang via spaylater selalu gerak cepat dan cepet beres prosesnya,selama ini pelayanan shopee baik saja apbl ada kendala return barang via spaylater selalu gerak cepat dan cepet beres prosesnya,5,Positif,2026-04-13 22:09:57
Lebih banyak waktu pengiriman cepat dan kualitasnya sesuai harga.,lebih banyak waktu pengiriman cepat dan kualitasnya sesuai harga,lebih banyak waktu pengiriman cepat dan kualitasnya sesuai harga,5,Positif,2026-04-13 22:08:29
selama ini puas belanja di shopee,selama ini puas belanja di shopee,selama ini puas belanja di shopee,5,Positif,2026-04-13 22:04:20
sopphi barangnya bagus2 dn pelayanan ok,sopphi barangnya bagus dn pelayanan ok,sopphi barangnya bagus dn pelayanan ok,5,Positif,2026-04-13 22:03:58
membantu,membantu,membantu,5,Positif,2026-04-13 22:03:22
Sangat 👍baguss,sangat baguss,sangat baguss,5,Positif,2026-04-13 21:57:15
aplikasi ini sangat membantu,aplikasi ini sangat membantu,aplikasi ini sangat membantu,5,Positif,2026-04-13 21:49:21
mempermudah ber belanja,mempermudah ber belanja,mempermudah ber belanja,5,Positif,2026-04-13 21:48:56
aplikasi ini sangat memuaskan dan baik,aplikasi ini sangat memuaskan dan baik,aplikasi ini sangat memuaskan dan baik,5,Positif,2026-04-13 21:45:03
pesanan stuck hampir 2 pekan ga ada perubahan komplen ga bisa.. padahal barangnya saya sangat butuh cepat...,pesanan stuck hampir pekan ga ada perubahan komplen ga bisa padahal barangnya saya sangat butuh cepat,pesanan stuck hampir pekan tidak ada perubahan komplen tidak bisa padahal barangnya saya sangat butuh cepat,1,Negatif,2026-04-13 21:42:02
bagus bngtt,bagus bngtt,bagus bngtt,5,Positif,2026-04-13 21:40:25
sangat bagus buat belanja online,sangat bagus buat belanja online,sangat bagus untuk belanja online,5,Positif,2026-04-13 21:36:17
shopee mantap ..cuma kemarin barang aku ada yg diambil.sama tukang paketnya katanya salah orang..gimana ya ..,shopee mantap cuma kemarin barang aku ada yg diambil sama tukang paketnya katanya salah orang gimana ya,shopee bagus/memuaskan cuma kemarin barang aku ada yg diambil sama tukang paketnya katanya salah orang gimana ya,5,Positif,2026-04-13 21:33:42
"Selalu puas banget berbelanja di shopee,walaupun aga lama estimasinya,tp brangnya selalu aman",selalu puas banget berbelanja di shopee walaupun aga lama estimasinya tp brangnya selalu aman,selalu puas banget berbelanja di shopee walaupun aga lama estimasinya tapi brangnya selalu aman,5,Positif,2026-04-13 21:29:40
Makin lama makin mahal ongkirnya malah lebih tinggi ongkirnya daripada harga barang nya sekarang Shopee sudah tidak asyik lagi dipakai buat belanja 🥱,makin lama makin mahal ongkirnya malah lebih tinggi ongkirnya daripada harga barang nya sekarang shopee sudah tidak asyik lagi dipakai buat belanja,makin lama makin mahal ongkirnya malah lebih tinggi ongkirnya daripada harga barang nya sekarang shopee sudah tidak asyik lagi dipakai untuk belanja,2,Negatif,2026-04-13 21:20:27
pengembalian barang sudah di setujui tapi kurir tidak datang sampai besok jika memang tidak bisa di kembalikan konfirmasi jangan membuat menunggu perbaiki sistemnya,pengembalian barang sudah di setujui tapi kurir tidak datang sampai besok jika memang tidak bisa di kembalikan konfirmasi jangan membuat menunggu perbaiki sistemnya,pengembalian barang sudah di setujui tapi kurir tidak datang sampai besok jika memang tidak bisa di kembalikan konfirmasi jangan membuat menunggu perbaiki sistemnya,1,Negatif,2026-04-13 21:20:14
shopi pokok nya top,shopi pokok nya top,shopi pokok nya top,5,Positif,2026-04-13 21:20:06
ad shopee di chrome menganggu sekali,ad shopee di chrome menganggu sekali,ad shopee di chrome menganggu sekali,1,Negatif,2026-04-13 21:17:50
Shopee terpercaya,shopee terpercaya,shopee terpercaya,5,Positif,2026-04-13 21:15:50
mengapa saldo saya di tahan pada tgl 13 April 2026,mengapa saldo saya di tahan pada tgl april,mengapa saldo saya di tahan pada tgl april,1,Negatif,2026-04-13 21:15:12
kenapa ya saya pas mau checkout iphone rp1 di flash sale suka susah padahal saya suka cepat checkoutnya tapi kalau parfum gambang checkoutnya gth,kenapa ya saya pas mau checkout iphone rp di flash sale suka susah padahal saya suka cepat checkoutnya tapi kalau parfum gambang checkoutnya gth,kenapa ya saya pas mau proses pembelian iphone rp di flash sale suka susah padahal saya suka cepat checkoutnya tapi kalau parfum gambang checkoutnya gth,4,Positif,2026-04-13 20:59:07
shopee sangat mengecewakan sekali. saya sangat kecewa KLO tidak ada tindak lanjut dengan akun saya. maka aplikasi ini saya hapus dan gak akan belanja lagi disini. saya sudah langganan lama sampai kurir hafal kok begini. percuma kita langganan dishoppe KLO perlakuan shope sama pelanggan seperti ini.,shopee sangat mengecewakan sekali saya sangat kecewa klo tidak ada tindak lanjut dengan akun saya maka aplikasi ini saya hapus dan gak akan belanja lagi disini saya sudah langganan lama sampai kurir hafal kok begini percuma kita langganan dishoppe klo perlakuan shope sama pelanggan seperti ini,shopee sangat mengecewakan sekali saya sangat kecewa kalau tidak ada tindak lanjut dengan akun saya maka aplikasi ini saya hapus dan tidak akan belanja lagi disini saya sudah langganan lama sampai kurir hafal kok begini percuma kita langganan dishoppe kalau perlakuan shope sama pelanggan seperti ini,1,Negatif,2026-04-13 20:53:33
lebih banyak ngebug pas udah lama kaga di buka,lebih banyak ngebug pas udah lama kaga di buka,lebih banyak ngebug pas sudah lama kaga di buka,3,Netral,2026-04-13 20:52:08
"Nama shopee pay knp ga bisa di ganti pakai nama panggilan sesuai keinginan pengguna nya, untuk keamanan akun kan bisa dgn nomor tlp dan e-mail. pembaruan kini mlh gk bisa COD dgn hrga promo, COD bsa dgunkan tpi hrga promo hilang mlh jdi harga normal nya, Kocak & kurir knp hrs spx mulu, pea. Sedang kan kurir spx gk ada ahlaklah, punya urusan beli barang di gw gk dibayar2, barang gk ada uangnya juga gk ada. Kacaulah sm kya kurir si cepat pea. update gk jelas Untuk validasi komisi`ya lama banget",nama shopee pay knp ga bisa di ganti pakai nama panggilan sesuai keinginan pengguna nya untuk keamanan akun kan bisa dgn nomor tlp dan e mail pembaruan kini mlh gk bisa cod dgn hrga promo cod bsa dgunkan tpi hrga promo hilang mlh jdi harga normal nya kocak kurir knp hrs spx mulu pea sedang kan kurir spx gk ada ahlaklah punya urusan beli barang di gw gk dibayar barang gk ada uangnya juga gk ada kacaulah sm kya kurir si cepat pea update gk jelas untuk validasi komisi ya lama banget,nama shopee pay knp tidak bisa di ganti pakai nama panggilan sesuai keinginan pengguna nya untuk keamanan akun kan bisa dengan nomor tlp dan e mail pembaruan kini mlh tidak bisa Cash on Delivery (bayar di tempat) dengan hrga promosi/diskon Cash on Delivery (bayar di tempat) bisa dgunkan tapi hrga promosi/diskon hilang mlh jdi harga normal nya kocak kurir knp harus spx mulu pea sedang kan kurir spx tidak ada ahlaklah punya urusan beli barang di gw tidak dibayar barang tidak ada uangnya juga tidak ada kacaulah sama kya kurir si cepat pea update tidak jelas untuk validasi komisi ya lama banget,1,Negatif,2026-04-13 20:50:13
kliatan sejenjang wajah di bawahnya ketujuan tampilan ia bisa nyangkut dan jadi kenangan selalu terSenyum,kliatan sejenjang wajah di bawahnya ketujuan tampilan ia bisa nyangkut dan jadi kenangan selalu tersenyum,kliatan sejenjang wajah di bawahnya ketujuan tampilan ia bisa nyangkut dan jadi kenangan selalu tersenyum,5,Positif,2026-04-13 20:48:38
"sayangnya ga bisa memblokir akun shopee lain, minta cs live malah mode boot trs",sayangnya ga bisa memblokir akun shopee lain minta cs live malah mode boot trs,sayangnya tidak bisa memblokir akun shopee lain minta cs live malah mode boot terus,1,Negatif,2026-04-13 20:45:20
mantap,mantap,bagus/memuaskan,5,Positif,2026-04-13 20:32:28
ini aplikasi iklannya terlalu sangat mengganggu!!!!!,ini aplikasi iklannya terlalu sangat mengganggu,ini aplikasi iklannya terlalu sangat mengganggu,1,Negatif,2026-04-13 20:27:24
bagus,bagus,bagus,5,Positif,2026-04-13 20:15:26
shopee gak kaya dlu lagi sekarang estimasi ga akurat ga pas susah nyiapin waktu trima brang saat sbuk krja estimasi sllu berubah dan undur waktu apa LG pesanan batre ke setag di sortir ga jalan2 LG hampir setengah bulan nunggu ga ad tanda2 jalan barang harusnya semakin bagus malah tambah bruk Skrang hdeuh,shopee gak kaya dlu lagi sekarang estimasi ga akurat ga pas susah nyiapin waktu trima brang saat sbuk krja estimasi sllu berubah dan undur waktu apa lg pesanan batre ke setag di sortir ga jalan lg hampir setengah bulan nunggu ga ad tanda jalan barang harusnya semakin bagus malah tambah bruk skrang hdeuh,shopee tidak kaya dulu lagi sekarang estimasi tidak akurat tidak pas susah nyiapin waktu trima brang saat sbuk krja estimasi sllu berubah dan undur waktu apa sedang/lagi pesanan batre ke setag di sortir tidak jalan sedang/lagi hampir setengah bulan nunggu tidak ad tanda jalan barang harusnya semakin bagus malah tambah bruk skrang hdeuh,4,Positif,2026-04-13 20:08:10
