review_asli,review_clean,review_normalized,rating,label,tanggal
"ekspedisi SPX ngga jelasss, pesanan udah lewat estimasi. kita komplain bukannya di usahakan pesanan agar cepat datang malah di suruh nunggu 2 hari dan di batalin. padahal kita butuh barangnya cepat",ekspedisi spx ngga jelasss pesanan udah lewat estimasi kita komplain bukannya di usahakan pesanan agar cepat datang malah di suruh nunggu hari dan di batalin padahal kita butuh barangnya cepat,ekspedisi spx tidak jelasss pesanan sudah lewat estimasi kita komplain bukannya di usahakan pesanan agar cepat datang malah di suruh nunggu hari dan di batalin padahal kita butuh barangnya cepat,1,Negatif,2026-04-14 11:48:07
tidak merespon keluhan customer,tidak merespon keluhan customer,tidak merespon keluhan customer,1,Negatif,2026-04-14 11:47:54
"akun sya tidak bisa shopee letter/shopee pinjam,, padahal sudah lama jg berlangganan sama shopee,, aq tu cod terus",akun sya tidak bisa shopee letter shopee pinjam padahal sudah lama jg berlangganan sama shopee aq tu cod terus,akun sya tidak bisa shopee letter shopee pinjam padahal sudah lama juga berlangganan sama shopee aq tu Cash on Delivery (bayar di tempat) terus,3,Netral,2026-04-14 11:45:09
"pesen instan tapi info dari toko selalu susah dapet driver. instan tapi datengnya besok,",pesen instan tapi info dari toko selalu susah dapet driver instan tapi datengnya besok,pesen instan tapi info dari toko selalu susah dapet driver instan tapi datengnya besok,1,Negatif,2026-04-14 11:43:42
untuk cs agen susah dihubungi refund tiket pesawat lama sudah 60 hari tidak kelar2 tolong ditambahkan layanan wa dsb email care susah mau komplain mudah2han dari playstore dapat terhubung ke pihak management mitra traveloka kalau ditravel agent lainya est 7 hari sudah kelar proses refund,untuk cs agen susah dihubungi refund tiket pesawat lama sudah hari tidak kelar tolong ditambahkan layanan wa dsb email care susah mau komplain mudah han dari playstore dapat terhubung ke pihak management mitra traveloka kalau ditravel agent lainya est hari sudah kelar proses refund,untuk cs agen susah dihubungi pengembalian uang tiket pesawat lama sudah hari tidak kelar tolong ditambahkan layanan wa dsb email care susah mau komplain mudah han dari playstore dapat terhubung ke pihak management mitra traveloka kalau ditravel agent lainya est hari sudah kelar proses pengembalian uang,1,Negatif,2026-04-14 11:43:33
sangat puas,sangat puas,sangat puas,5,Positif,2026-04-14 11:42:57
sangat baik bagu,sangat baik bagu,sangat baik bagu,5,Positif,2026-04-14 11:40:29
baik,baik,baik,5,Positif,2026-04-14 11:39:05
benarkah apa yang aku bilangin baru kemaren aku update sekarang muncul lagi update alasan versi terbaru alasan versi terbaru aku ini sudah ngomong sama costumer service shopee di aplikasi shopee tapi jawaban itu itu lah maaf iya jadi kalau aku mau pakai aplikasi shopee ini aku download terus kalau sudah selesai aku hapus seperti itu dari pada kedepannya minta update terus menerus,benarkah apa yang aku bilangin baru kemaren aku update sekarang muncul lagi update alasan versi terbaru alasan versi terbaru aku ini sudah ngomong sama costumer service shopee di aplikasi shopee tapi jawaban itu itu lah maaf iya jadi kalau aku mau pakai aplikasi shopee ini aku download terus kalau sudah selesai aku hapus seperti itu dari pada kedepannya minta update terus menerus,benarkah apa yang aku bilangin baru kemaren aku update sekarang muncul lagi update alasan versi terbaru alasan versi terbaru aku ini sudah ngomong sama costumer service shopee di aplikasi shopee tapi jawaban itu itu lah maaf iya jadi kalau aku mau pakai aplikasi shopee ini aku download terus kalau sudah selesai aku hapus seperti itu dari pada kedepannya minta update terus menerus,1,Negatif,2026-04-14 11:36:41
"Bagus, ada barang unik yang bisa dijual dan dipakai",bagus ada barang unik yang bisa dijual dan dipakai,bagus ada barang unik yang bisa dijual dan dipakai,5,Positif,2026-04-14 11:34:30
"Entah apa alasan nya memutus kerjasama dengan ekspedisi lain??? sedang kan SPX EXPRESS sangat lambat pengiriman nya barang sudah sampai di hub status barang sedang di antar tapi tidak sampai ke tangan pembeli dan para kurir SPX EXPRESS macam pejabat penting saja tingkah nya,di telpon di chat tidak di respon barang tidak di antar Andai kata malas ngantar tinggal aja di kantor biar pembeli yang ambil sendiri ke kantor.",entah apa alasan nya memutus kerjasama dengan ekspedisi lain sedang kan spx express sangat lambat pengiriman nya barang sudah sampai di hub status barang sedang di antar tapi tidak sampai ke tangan pembeli dan para kurir spx express macam pejabat penting saja tingkah nya di telpon di chat tidak di respon barang tidak di antar andai kata malas ngantar tinggal aja di kantor biar pembeli yang ambil sendiri ke kantor,entah apa alasan nya memutus kerjasama dengan ekspedisi lain sedang kan spx express sangat lambat pengiriman nya barang sudah sampai di hub status barang sedang di antar tapi tidak sampai ke tangan pembeli dan para kurir spx express macam pejabat penting saja tingkah nya di telpon di chat tidak di respon barang tidak di antar andai kata malas ngantar tinggal saja di kantor biar pembeli yang ambil sendiri ke kantor,1,Negatif,2026-04-14 11:33:22
Makasih shopee sudah bikin blanja nyaman sukses selalu,makasih shopee sudah bikin blanja nyaman sukses selalu,makasih shopee sudah bikin blanja nyaman sukses selalu,5,Positif,2026-04-14 11:32:19
sangat mudah apabila barang yg harus di kembalikan dan banyak gratis ongkir lagi,sangat mudah apabila barang yg harus di kembalikan dan banyak gratis ongkir lagi,sangat mudah apabila barang yg harus di kembalikan dan banyak gratis ongkos kirim lagi,5,Positif,2026-04-14 11:31:23
"kenapasi paket shopee datangnya makin lama, sebelumnya walau pake spx hemat datengnya tetap ga selama ini + ongkirnya juga ga terlalu mahal, sekarang malah gini agak ga suka si soalnya udah pesan barang jauh sebelum hari mau pake barangnya eh tetep aja masih lama, heran...",kenapasi paket shopee datangnya makin lama sebelumnya walau pake spx hemat datengnya tetap ga selama ini ongkirnya juga ga terlalu mahal sekarang malah gini agak ga suka si soalnya udah pesan barang jauh sebelum hari mau pake barangnya eh tetep aja masih lama heran,kenapasi paket shopee datangnya makin lama sebelumnya walau pake spx hemat datengnya tetap tidak selama ini ongkirnya juga tidak terlalu mahal sekarang malah gini agak tidak suka si soalnya sudah pesan barang jauh sebelum hari mau pake barangnya eh tetep saja masih lama heran,2,Negatif,2026-04-14 11:31:08
mantap aplikas bagus,mantap aplikas bagus,bagus/memuaskan aplikas bagus,5,Positif,2026-04-14 11:29:05
cukup membantu sekali.. cepat dan komplain cepat ditangani,cukup membantu sekali cepat dan komplain cepat ditangani,cukup membantu sekali cepat dan komplain cepat ditangani,5,Positif,2026-04-14 11:26:16
"Dengan adanya belanja online Shopee, saya sangat terbantu, belanja tdk hrs keluar rumah, sering ada promo, dan pastinya memudahkan saya sbg ibu rumah tangga",dengan adanya belanja online shopee saya sangat terbantu belanja tdk hrs keluar rumah sering ada promo dan pastinya memudahkan saya sbg ibu rumah tangga,dengan adanya belanja online shopee saya sangat terbantu belanja tdk harus keluar rumah sering ada promosi/diskon dan pastinya memudahkan saya sbg ibu rumah tangga,5,Positif,2026-04-14 11:25:17
beneran bsa narik,beneran bsa narik,beneran bisa narik,5,Positif,2026-04-14 11:23:48
"bagus ,oke pokonya sih untuk shopee",bagus oke pokonya sih untuk shopee,bagus oke pokonya partikel penegas untuk shopee,5,Positif,2026-04-14 11:23:13
"Shopee Indonesia menang bagus, mantap, aku suka banget. ...trimakasih",shopee indonesia menang bagus mantap aku suka banget trimakasih,shopee indonesia menang bagus bagus/memuaskan aku suka banget trimakasih,5,Positif,2026-04-14 11:22:42
pliss shopee kalo upgrade aplikasi tatak letak menu jangan ganti2 terus bikin pusing 😭,pliss shopee kalo upgrade aplikasi tatak letak menu jangan ganti terus bikin pusing,pliss shopee kalau upgrade aplikasi tatak letak menu jangan ganti terus bikin pusing,1,Negatif,2026-04-14 11:19:55
sangat membantu,sangat membantu,sangat membantu,5,Positif,2026-04-14 11:19:45
napa sich pinjaman padahal lancar tp ga di acc lagi ...,napa sich pinjaman padahal lancar tp ga di acc lagi,napa sich pinjaman padahal lancar tapi tidak di acc lagi,5,Positif,2026-04-14 11:15:53
aplikasinya bagus dan berkualitas fungsi baik,aplikasinya bagus dan berkualitas fungsi baik,aplikasinya bagus dan berkualitas fungsi baik,5,Positif,2026-04-14 11:14:33
bgus,bgus,bgus,5,Positif,2026-04-14 11:13:12
baru nyoba pindah dari apk sebelah ongkir mahal,baru nyoba pindah dari apk sebelah ongkir mahal,baru nyoba pindah dari apk sebelah ongkos kirim mahal,5,Positif,2026-04-14 11:12:15
mantap,mantap,bagus/memuaskan,5,Positif,2026-04-14 11:10:36
tidak dapat memesan,tidak dapat memesan,tidak dapat memesan,1,Negatif,2026-04-14 11:10:20
"tiati yg mau belanja di aplikasi ini, banyak penipuan, saya baru kena tipu, belanja seharga 3,3jt beli hp, yg dateng hp rusak, dan parah nya lg pihak shopee ga mau balikin duitnya... padahal bukti video unboxing udah jelas...",tiati yg mau belanja di aplikasi ini banyak penipuan saya baru kena tipu belanja seharga jt beli hp yg dateng hp rusak dan parah nya lg pihak shopee ga mau balikin duitnya padahal bukti video unboxing udah jelas,tiati yg mau belanja di aplikasi ini banyak penipuan saya baru kena tipu belanja seharga jt beli hp yg dateng hp rusak dan buruk sekali nya sedang/lagi pihak shopee tidak mau balikin duitnya padahal bukti video unboxing sudah jelas,1,Negatif,2026-04-14 11:10:19
good,good,good,5,Positif,2026-04-14 11:09:35
sangat membantu,sangat membantu,sangat membantu,5,Positif,2026-04-14 11:09:20
iklannya ngeselin,iklannya ngeselin,iklannya menjengkelkan,3,Netral,2026-04-14 11:05:56
bagusssss,bagusssss,bagusssss,5,Positif,2026-04-14 11:05:17
bagus banus/diskon dan gratis ongkir,bagus banus diskon dan gratis ongkir,bagus banus diskon dan gratis ongkos kirim,5,Positif,2026-04-14 11:04:21
ok,ok,ok,5,Positif,2026-04-14 11:02:52
Barangnya bagus,barangnya bagus,barangnya bagus,5,Positif,2026-04-14 11:02:36
bagus,bagus,bagus,5,Positif,2026-04-14 11:02:24
"e-commerce bagus, cuman ekspedisi nya lelet semua, cs bodo semua, ada masalah terlalu di anggap enteng",e commerce bagus cuman ekspedisi nya lelet semua cs bodo semua ada masalah terlalu di anggap enteng,e commerce bagus cuman ekspedisi nya lelet semua cs bodo semua ada masalah terlalu di anggap enteng,1,Negatif,2026-04-14 10:56:14
kurir Shopee daerah palu pemalas semua sudah 6 kali paket cod kurirnya malah suruh ambil di kantor..di tunggu besoknya paket malah di retur alasan pembeli menolak payah layanan kurir Shopee palu Sulteng,kurir shopee daerah palu pemalas semua sudah kali paket cod kurirnya malah suruh ambil di kantor di tunggu besoknya paket malah di retur alasan pembeli menolak payah layanan kurir shopee palu sulteng,kurir shopee daerah palu pemalas semua sudah kali paket Cash on Delivery (bayar di tempat) kurirnya malah suruh ambil di kantor di tunggu besoknya paket malah di pengembalian barang alasan pembeli menolak payah layanan kurir shopee palu sulteng,1,Negatif,2026-04-14 10:56:05
kmpret topup shopee pay kok ada minimum check out sekarang,kmpret topup shopee pay kok ada minimum check out sekarang,kmpret topup shopee pay kok ada minimum check out sekarang,2,Negatif,2026-04-14 10:55:10
selama ini layannan bagus.. yang penting tidak tergoda dengan harga murah ..pasti dapat yg murahan juga,selama ini layannan bagus yang penting tidak tergoda dengan harga murah pasti dapat yg murahan juga,selama ini layannan bagus yang penting tidak tergoda dengan harga murah pasti dapat yg murahan juga,5,Positif,2026-04-14 10:54:35
knpa shope aku gk bisa d buka trus klo masuk kya gk ada jaringan padahal jaringan bagus aja gmn ya padahal ada spylater lg 🥲,knpa shope aku gk bisa d buka trus klo masuk kya gk ada jaringan padahal jaringan bagus aja gmn ya padahal ada spylater lg,knpa shope aku tidak bisa d buka trus kalau masuk kya tidak ada jaringan padahal jaringan bagus saja gmn ya padahal ada spylater sedang/lagi,1,Negatif,2026-04-14 10:53:47
sangat membantu dan bermanfaat semoga tambah sukses...,sangat membantu dan bermanfaat semoga tambah sukses,sangat membantu dan bermanfaat semoga tambah sukses,5,Positif,2026-04-14 10:51:38
apk ini bagus tapi kadang ada produk yang tidak sesuai gambar,apk ini bagus tapi kadang ada produk yang tidak sesuai gambar,apk ini bagus tapi kadang ada produk yang tidak sesuai gambar,5,Positif,2026-04-14 10:51:30
"Lumayan bagus,saya mau tanya Napa saya tidak bisa shope,ngendala tiada internet.pada hal sudah kucoba buka yg lain bisa baik2 saja internet nya",lumayan bagus saya mau tanya napa saya tidak bisa shope ngendala tiada internet pada hal sudah kucoba buka yg lain bisa baik saja internet nya,lumayan bagus saya mau tanya napa saya tidak bisa shope ngendala tiada internet pada hal sudah kucoba buka yg lain bisa baik saja internet nya,5,Positif,2026-04-14 10:51:24
sangat puas,sangat puas,sangat puas,4,Positif,2026-04-14 10:50:23
sangat bagus,sangat bagus,sangat bagus,5,Positif,2026-04-14 10:50:04
kenapa saya tidak bisa ngirim shopee pay saya,kenapa saya tidak bisa ngirim shopee pay saya,kenapa saya tidak bisa ngirim shopee pay saya,3,Netral,2026-04-14 10:49:55
lebih mudah saat kebutuhan mendadak,lebih mudah saat kebutuhan mendadak,lebih mudah saat kebutuhan mendadak,5,Positif,2026-04-14 10:49:23
sangat bermanfaat buat yang lagi mager shop ke luar kota,sangat bermanfaat buat yang lagi mager shop ke luar kota,sangat bermanfaat untuk yang lagi mager shop ke luar kota,5,Positif,2026-04-14 10:49:16
"Pengiriman nya kacau, mengecewakan, barang tidak bisa langsung di ambil di drop point, harus nunggu kurir. sudah berkali2 barang yang tidak di antar kurir. malah dikembalikan ke penjual secara sepihak tanpa ada komunikasi apapun.",pengiriman nya kacau mengecewakan barang tidak bisa langsung di ambil di drop point harus nunggu kurir sudah berkali barang yang tidak di antar kurir malah dikembalikan ke penjual secara sepihak tanpa ada komunikasi apapun,pengiriman nya kacau mengecewakan barang tidak bisa langsung di ambil di drop point harus nunggu kurir sudah berkali barang yang tidak di antar kurir malah dikembalikan ke penjual secara sepihak tanpa ada komunikasi apapun,1,Negatif,2026-04-14 10:47:27
pesanan akhir2 ini sering stuck gak cuma sehari dua hari tapi sampai 1 minggu lebih. jadi pengirimannya sangat amat sering terlambat ! makin buruk ! kalau gak mampu mengatasi ledakan belanja harusnya tetap bekerja sama dengan ekspedisi lain. lebih suka pas j&t ada di shopee dibandingkan gak ada gini. lemot banget ekspedisi shopee express. paket sering stuck gak jelas. kecewa bgt.,pesanan akhir ini sering stuck gak cuma sehari dua hari tapi sampai minggu lebih jadi pengirimannya sangat amat sering terlambat makin buruk kalau gak mampu mengatasi ledakan belanja harusnya tetap bekerja sama dengan ekspedisi lain lebih suka pas j t ada di shopee dibandingkan gak ada gini lemot banget ekspedisi shopee express paket sering stuck gak jelas kecewa bgt,pesanan akhir ini sering stuck tidak cuma sehari dua hari tapi sampai minggu lebih jadi pengirimannya sangat amat sering terlambat makin buruk kalau tidak mampu mengatasi ledakan belanja harusnya tetap bekerja sama dengan ekspedisi lain lebih suka pas j t ada di shopee dibandingkan tidak ada gini lambat (aplikasi) banget ekspedisi shopee express paket sering stuck tidak jelas kecewa banget,1,Negatif,2026-04-14 10:47:15
keren,keren,keren,5,Positif,2026-04-14 10:45:05
mantaaab,mantaaab,mantaaab,5,Positif,2026-04-14 10:45:04
"kenapa klau aku pesan sering dibatalkan udh 2 kali kek gitu, klau udah mau sampai di batalkan, kenapa ya?",kenapa klau aku pesan sering dibatalkan udh kali kek gitu klau udah mau sampai di batalkan kenapa ya,kenapa klau aku pesan sering dibatalkan sudah kali kek gitu klau sudah mau sampai di batalkan kenapa ya,1,Negatif,2026-04-14 10:43:57
ongkir murah,ongkir murah,ongkos kirim murah,3,Netral,2026-04-14 10:42:23
alhmdulillah puas blnja di shopee dapet gratis ongkir trus,alhmdulillah puas blnja di shopee dapet gratis ongkir trus,alhmdulillah puas blnja di shopee dapet gratis ongkos kirim trus,5,Positif,2026-04-14 10:41:43
sangat membantu,sangat membantu,sangat membantu,5,Positif,2026-04-14 10:41:10
"shoppe makin lama makin ga beres ya,buat shoppe kalo kurir² ga niat kerja itu gausa di rekrut saya nunggu paket saya dari tanggal:3 april sampe sekarang gada sampe²,alasan nya di aplikasi,dalam proses pengantaran.macem rumah saya di kamboja ya? padahal rumah saya masi di daerah indonesia tapi lama nya minta ampun,kalo kurir yang ga niat kerja gausa di rekrut untuk kerja,apalagi buat kurir yang panjang tangan,ini saran dan pesan dari saya aja ya udah gitu nomor kurir nya gada ga kaya sebelah hdeh",shoppe makin lama makin ga beres ya buat shoppe kalo kurir ga niat kerja itu gausa di rekrut saya nunggu paket saya dari tanggal april sampe sekarang gada sampe alasan nya di aplikasi dalam proses pengantaran macem rumah saya di kamboja ya padahal rumah saya masi di daerah indonesia tapi lama nya minta ampun kalo kurir yang ga niat kerja gausa di rekrut untuk kerja apalagi buat kurir yang panjang tangan ini saran dan pesan dari saya aja ya udah gitu nomor kurir nya gada ga kaya sebelah hdeh,shoppe makin lama makin tidak beres ya untuk shoppe kalau kurir tidak niat kerja itu gausa di rekrut saya nunggu paket saya dari tanggal april sampe sekarang gada sampe alasan nya di aplikasi dalam proses pengantaran macem rumah saya di kamboja ya padahal rumah saya masi di daerah indonesia tapi lama nya minta ampun kalau kurir yang tidak niat kerja gausa di rekrut untuk kerja apalagi untuk kurir yang panjang tangan ini saran dan pesan dari saya saja ya sudah gitu nomor kurir nya gada tidak kaya sebelah hdeh,1,Negatif,2026-04-14 10:40:42
"Sangat-sangat tidak menghargai pelanggan,saya terkena kasus COD dihapus sama sekali dan tidak tampil dipilihan metode pembayaran tanpa sebab dan saya tidak pernah melakukan kesalahan apapun apalagi rektur pembelian,dan juga tempat saya dekat dengan kota;COD nya ada,tapi saat di hubungi CS Shopeenya malah ngawur jawabannya dan saat dicoba melalui chat CS nya malah berubah-rubah orangnya,bukan dicari masalahnya tapi malah menambah masalah..,sangat mengecewakan sekali",sangat sangat tidak menghargai pelanggan saya terkena kasus cod dihapus sama sekali dan tidak tampil dipilihan metode pembayaran tanpa sebab dan saya tidak pernah melakukan kesalahan apapun apalagi rektur pembelian dan juga tempat saya dekat dengan kota cod nya ada tapi saat di hubungi cs shopeenya malah ngawur jawabannya dan saat dicoba melalui chat cs nya malah berubah rubah orangnya bukan dicari masalahnya tapi malah menambah masalah sangat mengecewakan sekali,sangat sangat tidak menghargai pelanggan saya terkena kasus Cash on Delivery (bayar di tempat) dihapus sama sekali dan tidak tampil dipilihan metode pembayaran tanpa sebab dan saya tidak pernah melakukan kesalahan apapun apalagi rektur pembelian dan juga tempat saya dekat dengan kota Cash on Delivery (bayar di tempat) nya ada tapi saat di hubungi cs shopeenya malah ngawur jawabannya dan saat dicoba melalui chat cs nya malah berubah rubah orangnya bukan dicari masalahnya tapi malah menambah masalah sangat mengecewakan sekali,1,Negatif,2026-04-14 10:39:46
"apk ini sangatlah buruk banget terutama kurir dan pelayanannya, saya sangat kecewa berat, paket saya tidak pernah diantarkan oleh sang kurir hingga melewati waktu estimasi nya selain itu kurir nya seperti tidak mau mengantarkan memang keliatannya kalau malas mengantarkan kan bisa dialihkan ke kurir lain, lah ini kgk sama sekali dan cuek aja dan sistem nya memang kurang di siplin kurir nya, jgn belanja di apk ini klu ga kalian akan menyesalinya sendiri nanti 😡",apk ini sangatlah buruk banget terutama kurir dan pelayanannya saya sangat kecewa berat paket saya tidak pernah diantarkan oleh sang kurir hingga melewati waktu estimasi nya selain itu kurir nya seperti tidak mau mengantarkan memang keliatannya kalau malas mengantarkan kan bisa dialihkan ke kurir lain lah ini kgk sama sekali dan cuek aja dan sistem nya memang kurang di siplin kurir nya jgn belanja di apk ini klu ga kalian akan menyesalinya sendiri nanti,apk ini sangatlah buruk banget terutama kurir dan pelayanannya saya sangat kecewa berat paket saya tidak pernah diantarkan oleh sang kurir hingga melewati waktu estimasi nya selain itu kurir nya seperti tidak mau mengantarkan memang keliatannya kalau malas mengantarkan kan bisa dialihkan ke kurir lain lah ini kgk sama sekali dan cuek saja dan sistem nya memang kurang di siplin kurir nya jgn belanja di apk ini kalau tidak kalian akan menyesalinya sendiri nanti,1,Negatif,2026-04-14 10:37:00
"untuk menonaktifkan fitur face id saat pembayaran tidak ada,masa harus 2 kali verifikasi habis sidik masih disuruh juga face id",untuk menonaktifkan fitur face id saat pembayaran tidak ada masa harus kali verifikasi habis sidik masih disuruh juga face id,untuk menonaktifkan fitur face id saat pembayaran tidak ada masa harus kali verifikasi habis sidik masih disuruh juga face id,2,Negatif,2026-04-14 10:36:01
bagus,bagus,bagus,5,Positif,2026-04-14 10:35:42
sangat membantu,sangat membantu,sangat membantu,5,Positif,2026-04-14 10:35:39
oke oke,oke oke,oke oke,5,Positif,2026-04-14 10:34:40
bagus banget aplikasi nya banyak voucher pula dan murah murah,bagus banget aplikasi nya banyak voucher pula dan murah murah,bagus banget aplikasi nya banyak kupon diskon pula dan murah murah,5,Positif,2026-04-14 10:34:37
apknya okeh TPI apk drivernya GK ngotak bawa barang 80 dri Cibinong ke Tangsel blom sellernya GK diinput panjang lebarnya tolong lah diperbaiki systemnya blom lagi aturan baru difoto resinya harus jelas bnyak sellernya pake kertas spidol susah buat uploadnya bnyak beban ke drivernya min apa apa suspend coba lah kalian yang buat systemnya jadi drivernya enak apa GK nya dan sameday jarak dri Cibinong sampe Jaktim argo 77k aja gmna GK haus main food tiba tiba spx kan aneh,apknya okeh tpi apk drivernya gk ngotak bawa barang dri cibinong ke tangsel blom sellernya gk diinput panjang lebarnya tolong lah diperbaiki systemnya blom lagi aturan baru difoto resinya harus jelas bnyak sellernya pake kertas spidol susah buat uploadnya bnyak beban ke drivernya min apa apa suspend coba lah kalian yang buat systemnya jadi drivernya enak apa gk nya dan sameday jarak dri cibinong sampe jaktim argo k aja gmna gk haus main food tiba tiba spx kan aneh,apknya okeh tapi apk drivernya tidak ngotak bawa barang dri cibinong ke tangsel blom sellernya tidak diinput panjang lebarnya tolong lah diperbaiki systemnya blom lagi aturan baru difoto resinya harus jelas bnyak sellernya pake kertas spidol susah untuk uploadnya bnyak beban ke drivernya min apa apa suspend coba lah kalian yang untuk systemnya jadi drivernya enak apa tidak nya dan sameday jarak dri cibinong sampe jaktim argo k saja gmna tidak haus main food tiba tiba spx kan aneh,1,Negatif,2026-04-14 10:34:05
"Tolong di pengaturan akun ada opsi ganti username, terimakasih atas perhatiannya",tolong di pengaturan akun ada opsi ganti username terimakasih atas perhatiannya,tolong di pengaturan akun ada opsi ganti username terimakasih atas perhatiannya,5,Positif,2026-04-14 10:33:51
bagus,bagus,bagus,3,Netral,2026-04-14 10:32:44
kebanyakan iklan disemua aplikasi,kebanyakan iklan disemua aplikasi,kebanyakan iklan disemua aplikasi,1,Negatif,2026-04-14 10:32:05
mantap,mantap,bagus/memuaskan,5,Positif,2026-04-14 10:30:27
mantab betul,mantab betul,mantab betul,5,Positif,2026-04-14 10:28:53
udah bagus kurang notif aja sih coba kalo ada notif barang yg udah habis bisa dikasih notif kalo barang udah ready pasti sangat membantu,udah bagus kurang notif aja sih coba kalo ada notif barang yg udah habis bisa dikasih notif kalo barang udah ready pasti sangat membantu,sudah bagus kurang notif saja partikel penegas coba kalau ada notif barang yg sudah habis bisa dikasih notif kalau barang sudah ready pasti sangat membantu,5,Positif,2026-04-14 10:26:29
bagus,bagus,bagus,5,Positif,2026-04-14 10:24:45
"bisa cari banyak barang dengan banyak pilihan, harga bersaing dan free ongkir",bisa cari banyak barang dengan banyak pilihan harga bersaing dan free ongkir,bisa cari banyak barang dengan banyak pilihan harga bersaing dan free ongkos kirim,5,Positif,2026-04-14 10:24:07
saya suka,saya suka,saya suka,5,Positif,2026-04-14 10:21:09
terimakasih kepada semua pihak shopee.. saya terbantu masalah ekonomi dan berkerjaan.. allhamdulilah,terimakasih kepada semua pihak shopee saya terbantu masalah ekonomi dan berkerjaan allhamdulilah,terimakasih kepada semua pihak shopee saya terbantu masalah ekonomi dan berkerjaan allhamdulilah,5,Positif,2026-04-14 10:19:27
"saran sedikit untuk shopee indonesia, supaya mencantumkan nomor telepon kurir di data pelacakan pengiriman barang, seperti apk tokop*d*a. karena terkadang barang kembali namun kurir tidak ada telepon ataupun menghubungi penerima. dan bahkan sering kurir menitipkan barang tanpa konfirmasi. terima kasih",saran sedikit untuk shopee indonesia supaya mencantumkan nomor telepon kurir di data pelacakan pengiriman barang seperti apk tokop d a karena terkadang barang kembali namun kurir tidak ada telepon ataupun menghubungi penerima dan bahkan sering kurir menitipkan barang tanpa konfirmasi terima kasih,saran sedikit untuk shopee indonesia supaya mencantumkan nomor telepon kurir di data pelacakan pengiriman barang seperti apk tokop d a karena terkadang barang kembali namun kurir tidak ada telepon ataupun menghubungi penerima dan bahkan sering kurir menitipkan barang tanpa konfirmasi terima kasih,4,Positif,2026-04-14 10:19:23
saya Kash bintang 5,saya kash bintang,saya kash bintang,5,Positif,2026-04-14 10:17:19
okeyy,okeyy,okeyy,5,Positif,2026-04-14 10:16:46
