review_asli,review_clean,review_normalized,rating,label,tanggal
Alhamdulillah selama belanja di toko ini ga pernah bermasalah,alhamdulillah selama belanja di toko ini ga pernah bermasalah,alhamdulillah selama belanja di toko ini tidak pernah bermasalah,5,Positif,2026-04-13 09:16:29
baik☺️,baik,baik,5,Positif,2026-04-13 09:15:38
"kenapa jika pengiriman ditunda oleh keterlambatan kurir spx selalu ada notif ""PENGIMAN DITUNDA, PEMBELI MENJADWALKAN ULANG PENGIRIMAN"" padahal sdh jelas² paket kita tungguin. terlambat kirim dari kurir, kok pembeli yg jadwalkan ulang? aneh...",kenapa jika pengiriman ditunda oleh keterlambatan kurir spx selalu ada notif pengiman ditunda pembeli menjadwalkan ulang pengiriman padahal sdh jelas paket kita tungguin terlambat kirim dari kurir kok pembeli yg jadwalkan ulang aneh,kenapa jika pengiriman ditunda oleh keterlambatan kurir spx selalu ada notif pengiman ditunda pembeli menjadwalkan ulang pengiriman padahal sudah jelas paket kita tungguin terlambat kirim dari kurir kok pembeli yg jadwalkan ulang aneh,3,Netral,2026-04-13 09:14:59
bagus,bagus,bagus,5,Positif,2026-04-13 09:11:41
beberapa fitur bermasalah mulu,beberapa fitur bermasalah mulu,beberapa fitur bermasalah mulu,1,Negatif,2026-04-13 09:10:44
sangat puas blnja d shoppe,sangat puas blnja d shoppe,sangat puas blnja d shoppe,5,Positif,2026-04-13 09:08:59
memudahkan dalam berbelanja apapun itu kebutuhannya 👍,memudahkan dalam berbelanja apapun itu kebutuhannya,memudahkan dalam berbelanja apapun itu kebutuhannya,5,Positif,2026-04-13 09:08:32
Ok................👌,ok,ok,5,Positif,2026-04-13 09:05:08
sangat menbantu ketika kita membutuhkan ap yg kita cari,sangat menbantu ketika kita membutuhkan ap yg kita cari,sangat menbantu ketika kita membutuhkan ap yg kita cari,5,Positif,2026-04-13 09:04:38
Layanan Spx nya masih perlu di tingkatkan. Pelayanan Lama 😒. apalagi kurirnya. lemottt,layanan spx nya masih perlu di tingkatkan pelayanan lama apalagi kurirnya lemottt,layanan spx nya masih perlu di tingkatkan pelayanan lama apalagi kurirnya lemottt,1,Negatif,2026-04-13 09:04:38
amanah,amanah,amanah,5,Positif,2026-04-13 09:03:29
pas main game capit premium selalu dijatohin mulu kenapa si mana nyari koinnya lama,pas main game capit premium selalu dijatohin mulu kenapa si mana nyari koinnya lama,pas main game capit premium selalu dijatohin mulu kenapa si mana nyari koinnya lama,2,Negatif,2026-04-13 09:02:50
ganggu amat vidionya,ganggu amat vidionya,ganggu amat vidionya,1,Negatif,2026-04-13 08:58:15
pengguna baru ga dapet voucher lol,pengguna baru ga dapet voucher lol,pengguna baru tidak dapet kupon diskon lol,1,Negatif,2026-04-13 08:54:58
marketing nya bagus sekali😂😂 nyampenya 2-3 hari aslinya 1-2hari,marketing nya bagus sekali nyampenya hari aslinya hari,marketing nya bagus sekali nyampenya hari aslinya hari,5,Positif,2026-04-13 08:52:38
"proses pengajuan pengembalian barang di persulit,ga tau dari pihak shoope atau pihak penjual.blokir toko2 yg nipu2 lah",proses pengajuan pengembalian barang di persulit ga tau dari pihak shoope atau pihak penjual blokir toko yg nipu lah,proses pengajuan pengembalian barang di persulit tidak tau dari pihak shoope atau pihak penjual blokir toko yg nipu lah,1,Negatif,2026-04-13 08:52:08
Sayang belum bisa menggunakan SpayLater nya Shoppe,sayang belum bisa menggunakan spaylater nya shoppe,sayang belum bisa menggunakan spaylater nya shoppe,5,Positif,2026-04-13 08:51:56
good,good,good,5,Positif,2026-04-13 08:50:03
mantap,mantap,bagus/memuaskan,5,Positif,2026-04-13 08:49:17
"aku ada barang mau dikembaliin karna cacat di awal (pesen lip gloss tapi ngga ada aplikatornya). udah chat seller tapi malah ngga dianggap. pencet opsi bantuan ama shopee, AI yang ngechat malah melintir. udah dibilang kalau waktu proses pengembaliannya cuman ada opsi ke jasa kirim atau mandiri. keberatan dong, dari awal itu barang cacat. buat apa aku cape-cape? seller sama AI Shopee ini ngga berguna banget. mana sellernya juga pake asisten AI.",aku ada barang mau dikembaliin karna cacat di awal pesen lip gloss tapi ngga ada aplikatornya udah chat seller tapi malah ngga dianggap pencet opsi bantuan ama shopee ai yang ngechat malah melintir udah dibilang kalau waktu proses pengembaliannya cuman ada opsi ke jasa kirim atau mandiri keberatan dong dari awal itu barang cacat buat apa aku cape cape seller sama ai shopee ini ngga berguna banget mana sellernya juga pake asisten ai,aku ada barang mau dikembaliin karena cacat di awal pesen lip gloss tapi tidak ada aplikatornya sudah chat penjual tapi malah tidak dianggap pencet opsi bantuan ama shopee ai yang ngechat malah melintir sudah dibilang kalau waktu proses pengembaliannya cuman ada opsi ke jasa kirim atau mandiri keberatan saja (partikel penegas) dari awal itu barang cacat untuk apa aku cape cape penjual sama ai shopee ini tidak berguna banget mana sellernya juga pake asisten ai,2,Negatif,2026-04-13 08:48:06
murah,murah,murah,5,Positif,2026-04-13 08:46:47
pokoknya shoope amanah dan baik 👍👍👍,pokoknya shoope amanah dan baik,pokoknya shoope amanah dan baik,5,Positif,2026-04-13 08:46:41
"aku jarang banget Lo mau komen komen kekgini,tapi kali ni aku kesel aku dah pake apk ini dri lama gda masalah apa apa tapi knpa skrng pengiriman shope lama kali Sampek lebih dua Minggu tolong dong di perhatikan",aku jarang banget lo mau komen komen kekgini tapi kali ni aku kesel aku dah pake apk ini dri lama gda masalah apa apa tapi knpa skrng pengiriman shope lama kali sampek lebih dua minggu tolong dong di perhatikan,aku jarang banget lo mau komen komen kekgini tapi kali ni aku kesal aku sudah pake apk ini dri lama gda masalah apa apa tapi knpa skrng pengiriman shope lama kali sampek lebih dua minggu tolong saja (partikel penegas) di perhatikan,1,Negatif,2026-04-13 08:45:08
ok,ok,ok,5,Positif,2026-04-13 08:43:18
setiap perhari atau perminggu belanja banyak terus tapi Spinjam gak bisa. Aneh,setiap perhari atau perminggu belanja banyak terus tapi spinjam gak bisa aneh,setiap perhari atau perminggu belanja banyak terus tapi spinjam tidak bisa aneh,5,Positif,2026-04-13 08:43:04
good,good,good,5,Positif,2026-04-13 08:43:01
mantap,mantap,bagus/memuaskan,5,Positif,2026-04-13 08:41:22
selama pembelian di Shopee TDK pernah merasakan kekecewaan,selama pembelian di shopee tdk pernah merasakan kekecewaan,selama pembelian di shopee tdk pernah merasakan kekecewaan,5,Positif,2026-04-13 08:40:13
puas banget,puas banget,puas banget,5,Positif,2026-04-13 08:32:52
bgus,bgus,bgus,5,Positif,2026-04-13 08:31:03
sudah mulai kesal dengan aplikasi ini...sudah banyak perkeliruannya satu contoh estimasi pengiriman selalu jauh dari kata tepat waktu giliran telat bayar spinjam n spaylater penagihannya ngamuk gk karuan...pdhl besarnya cm ribuan gk sampe jutaan aplg milyaran 😅😅😅,sudah mulai kesal dengan aplikasi ini sudah banyak perkeliruannya satu contoh estimasi pengiriman selalu jauh dari kata tepat waktu giliran telat bayar spinjam n spaylater penagihannya ngamuk gk karuan pdhl besarnya cm ribuan gk sampe jutaan aplg milyaran,sudah mulai kesal dengan aplikasi ini sudah banyak perkeliruannya satu contoh estimasi pengiriman selalu jauh dari kata tepat waktu giliran telat bayar spinjam n spaylater penagihannya ngamuk tidak karuan pdhl besarnya cm ribuan tidak sampe jutaan aplg milyaran,1,Negatif,2026-04-13 08:29:29
belanja di Shopee emang mudah dan gampang sesuai kebutuhan,belanja di shopee emang mudah dan gampang sesuai kebutuhan,belanja di shopee memang mudah dan gampang sesuai kebutuhan,5,Positif,2026-04-13 08:29:05
saya sudah hapus aplikasi ini. kecewa saldo shopee pay saya. kepotong sendiri. cek di riwayat kepotong karna upgred ke shoppe pay vip. sedangkan. saya g melakukannya konfimasi.. tidak ada solusi tetap uang g kembali... padahan hanya uang receh 29.900..bagaimana. terjadi sama orang yg gaptek... yh ini hanya berbagi pengalaman ajah.,saya sudah hapus aplikasi ini kecewa saldo shopee pay saya kepotong sendiri cek di riwayat kepotong karna upgred ke shoppe pay vip sedangkan saya g melakukannya konfimasi tidak ada solusi tetap uang g kembali padahan hanya uang receh bagaimana terjadi sama orang yg gaptek yh ini hanya berbagi pengalaman ajah,saya sudah hapus aplikasi ini kecewa saldo shopee pay saya kepotong sendiri cek di riwayat kepotong karena upgred ke shoppe pay vip sedangkan saya tidak melakukannya konfimasi tidak ada solusi tetap uang tidak kembali padahan hanya uang receh bagaimana terjadi sama orang yg gaptek yh ini hanya berbagi pengalaman ajah,1,Negatif,2026-04-13 08:28:32
KNP SIHHH KURIR SHOPEE SUKA SEENAKNYA GANTI JADWAL PENGIRIMAN PDHL PAKET BELUM DIANTER KERUMAH?¿???? udah gt gak bisa chat kurirnya jadi kan bingung kalo mau ngabarin gaada orang dirumah. ini paket blm dianter samsek kerumah tbtb pembeli menjadwalkan ulang pengantaran LAAHHHH KPN GW BILANG GT???????? UDALAH PAKET GW NYANGKUT 4 HARI DI TANGERANG YA SHOPEE LU BNR2!!!!,knp sihhh kurir shopee suka seenaknya ganti jadwal pengiriman pdhl paket belum dianter kerumah udah gt gak bisa chat kurirnya jadi kan bingung kalo mau ngabarin gaada orang dirumah ini paket blm dianter samsek kerumah tbtb pembeli menjadwalkan ulang pengantaran laahhhh kpn gw bilang gt udalah paket gw nyangkut hari di tangerang ya shopee lu bnr,knp sihhh kurir shopee suka seenaknya ganti jadwal pengiriman pdhl paket belum dianter kerumah sudah gt tidak bisa chat kurirnya jadi kan bingung kalau mau ngabarin gaada orang dirumah ini paket belum dianter samsek kerumah tbtb pembeli menjadwalkan ulang pengantaran laahhhh kpn gw bilang gt udalah paket gw nyangkut hari di tangerang ya shopee lu bnr,1,Negatif,2026-04-13 08:28:09
"OK, good udah jadi bintang 5. Pengennya bintang 7, karena bintangnya 5 jadi 5 aja deh..🫢👊🏻",ok good udah jadi bintang pengennya bintang karena bintangnya jadi aja deh,ok good sudah jadi bintang pengennya bintang karena bintangnya jadi saja partikel penegas,5,Positif,2026-04-13 08:26:38
perfect,perfect,perfect,5,Positif,2026-04-13 08:25:39
kalo bisa pengiriman lebih di percepat lagi,kalo bisa pengiriman lebih di percepat lagi,kalau bisa pengiriman lebih di percepat lagi,5,Positif,2026-04-13 08:22:33
"Cs NYA OMONGAN NYA BERUBAH² , sangat kecewa ..",cs nya omongan nya berubah sangat kecewa,cs nya omongan nya berubah sangat kecewa,1,Negatif,2026-04-13 08:21:44
lancar jaya,lancar jaya,lancar jaya,5,Positif,2026-04-13 08:21:32
"mantul Sangat membantu,semua jadi mudah dan gak ribet",mantul sangat membantu semua jadi mudah dan gak ribet,mantap betul (sangat bagus) sangat membantu semua jadi mudah dan tidak rumit/tidak praktis,5,Positif,2026-04-13 08:21:11
"aduhhhhh ini makin kesini kok jasa kirim spx masikin sampah, masa pesanan stuck berhari-hari gk dikirim! sangat mengecewakan! sudah menghubungi pihak terkait juga gk ada perubahan.",aduhhhhh ini makin kesini kok jasa kirim spx masikin sampah masa pesanan stuck berhari hari gk dikirim sangat mengecewakan sudah menghubungi pihak terkait juga gk ada perubahan,aduhhhhh ini makin kesini kok jasa kirim spx masikin sampah masa pesanan stuck berhari hari tidak dikirim sangat mengecewakan sudah menghubungi pihak terkait juga tidak ada perubahan,1,Negatif,2026-04-13 08:18:32
kualitas Nya bagus,kualitas nya bagus,kualitas nya bagus,5,Positif,2026-04-13 08:18:27
baik,baik,baik,5,Positif,2026-04-13 08:18:00
sangat puas belanja di sini,sangat puas belanja di sini,sangat puas belanja di sini,5,Positif,2026-04-13 08:17:54
"shoppee merupakan aplikasi yang sangat banyak digemari dikalangan remaja,dan orang dewasa yg membantu masyarakat membeli barang yang disukai dengan mudah dan hanya lewat media aplikasi tanpa harus keluar rumah.",shoppee merupakan aplikasi yang sangat banyak digemari dikalangan remaja dan orang dewasa yg membantu masyarakat membeli barang yang disukai dengan mudah dan hanya lewat media aplikasi tanpa harus keluar rumah,shoppee merupakan aplikasi yang sangat banyak digemari dikalangan remaja dan orang dewasa yg membantu masyarakat membeli barang yang disukai dengan mudah dan hanya lewat media aplikasi tanpa harus keluar rumah,4,Positif,2026-04-13 08:17:00
baru pertama beli ayamnya kecil banget 🤭😝,baru pertama beli ayamnya kecil banget,baru pertama beli ayamnya kecil banget,5,Positif,2026-04-13 08:16:50
shopenya lelet makanya saya kasih bintang 2 dan pengirimanya lama juga,shopenya lelet makanya saya kasih bintang dan pengirimanya lama juga,shopenya lelet makanya saya kasih bintang dan pengirimanya lama juga,2,Negatif,2026-04-13 08:15:52
banyak iklan gak jelas dan pop up yang banyak banget,banyak iklan gak jelas dan pop up yang banyak banget,banyak iklan tidak jelas dan pop up yang banyak banget,1,Negatif,2026-04-13 08:12:55
suka banget tauk🤍,suka banget tauk,suka banget tauk,5,Positif,2026-04-13 08:11:26
👍👍Baik,baik,baik,5,Positif,2026-04-13 08:10:01
aplikasi andalan utk berbelanja online. bestnya bisa pilih jasa pengiriman yg kita inginkan.,aplikasi andalan utk berbelanja online bestnya bisa pilih jasa pengiriman yg kita inginkan,aplikasi andalan untuk berbelanja online bestnya bisa pilih jasa pengiriman yg kita inginkan,5,Positif,2026-04-13 08:06:46
"saya suka berbelanja di shopee, murah"" barangnya",saya suka berbelanja di shopee murah barangnya,saya suka berbelanja di shopee murah barangnya,5,Positif,2026-04-13 08:06:08
Penanganan kerugian penerimaan barang rusak sangat bertele2 seperti gkmau tanggungjawab.,penanganan kerugian penerimaan barang rusak sangat bertele seperti gkmau tanggungjawab,penanganan kerugian penerimaan barang rusak sangat bertele seperti gkmau tanggungjawab,5,Positif,2026-04-13 08:03:40
suka banget,suka banget,suka banget,5,Positif,2026-04-13 08:02:14
mantaplah,mantaplah,mantaplah,5,Positif,2026-04-13 07:59:01
sebagai pengguna shopee ak cukup puas dgn apk tsb,sebagai pengguna shopee ak cukup puas dgn apk tsb,sebagai pengguna shopee ak cukup puas dengan apk tsb,5,Positif,2026-04-13 07:59:00
Alhamdulillah selama belanja di shopee selalu Puas...,alhamdulillah selama belanja di shopee selalu puas,alhamdulillah selama belanja di shopee selalu puas,5,Positif,2026-04-13 07:57:47
oke joss,oke joss,oke joss,5,Positif,2026-04-13 07:57:16
Belanja online untuk mempermudah. Namun konpensasi keterlambatan paket vocer 10.000 sangat2 tidak membantu 🙏 Boleh dong 10.000 nya jadi saldo shoppepay aja. Itu akan sangat berguna.,belanja online untuk mempermudah namun konpensasi keterlambatan paket vocer sangat tidak membantu boleh dong nya jadi saldo shoppepay aja itu akan sangat berguna,belanja online untuk mempermudah namun konpensasi keterlambatan paket vocer sangat tidak membantu boleh saja (partikel penegas) nya jadi saldo shoppepay saja itu akan sangat berguna,1,Negatif,2026-04-13 07:56:03
selalu sesuai pesanan yng ada di gambarr,selalu sesuai pesanan yng ada di gambarr,selalu sesuai pesanan yng ada di gambarr,5,Positif,2026-04-13 07:55:58
Sangat bagus,sangat bagus,sangat bagus,5,Positif,2026-04-13 07:55:41
"Shopee aplikasi yang bagus, memudahkan dalam belanja, dan berbelanja lewat Shopee relatif lebih murah harganya 👍🏻",shopee aplikasi yang bagus memudahkan dalam belanja dan berbelanja lewat shopee relatif lebih murah harganya,shopee aplikasi yang bagus memudahkan dalam belanja dan berbelanja lewat shopee relatif lebih murah harganya,5,Positif,2026-04-13 07:55:35
"ini apk eror,dengan fitur lacak pesanan",ini apk eror dengan fitur lacak pesanan,ini apk eror dengan fitur lacak pesanan,3,Netral,2026-04-13 07:54:37
"Pengalaman pertama melakukan penarikan. Terasa mudah dan sangat bermanfaat bagi saya. semoga kedepannya bisa menarik lebih besar lagi dan mampu menjadi salah satu inspirasi bagi teman-teman semuanya pengguna sophee khususnya. jangan pernahenyerah jika mengalami kegagalan. terimakasih pada semuanya. Belanja terasa murah,udah dan efisien. membuat semua terasa memiliki toko sendiri, tanpa ribet dan gampang. hanya beberapa detik tanpa keluar rumah semua kebutuhan terpenuhi dengan standar bagus....",pengalaman pertama melakukan penarikan terasa mudah dan sangat bermanfaat bagi saya semoga kedepannya bisa menarik lebih besar lagi dan mampu menjadi salah satu inspirasi bagi teman teman semuanya pengguna sophee khususnya jangan pernahenyerah jika mengalami kegagalan terimakasih pada semuanya belanja terasa murah udah dan efisien membuat semua terasa memiliki toko sendiri tanpa ribet dan gampang hanya beberapa detik tanpa keluar rumah semua kebutuhan terpenuhi dengan standar bagus,pengalaman pertama melakukan penarikan terasa mudah dan sangat bermanfaat bagi saya semoga kedepannya bisa menarik lebih besar lagi dan mampu menjadi salah satu inspirasi bagi teman teman semuanya pengguna sophee khususnya jangan pernahenyerah jika mengalami kegagalan terimakasih pada semuanya belanja terasa murah sudah dan efisien membuat semua terasa memiliki toko sendiri tanpa rumit/tidak praktis dan gampang hanya beberapa detik tanpa keluar rumah semua kebutuhan terpenuhi dengan standar bagus,5,Positif,2026-04-13 07:54:26
"pengiriman nya lama , paket stuck di situh ga berubah2",pengiriman nya lama paket stuck di situh ga berubah,pengiriman nya lama paket stuck di situh tidak berubah,1,Negatif,2026-04-13 07:53:33
Sekarang pengiriman lewat spx sangat lama,sekarang pengiriman lewat spx sangat lama,sekarang pengiriman lewat spx sangat lama,4,Positif,2026-04-13 07:52:50
"akun diretas orang lain, pelaporan sudah 10x lebih tidak ada hasilnya, ktp, foto selfie sudah dicantumkan! tapi selalu gagal.",akun diretas orang lain pelaporan sudah x lebih tidak ada hasilnya ktp foto selfie sudah dicantumkan tapi selalu gagal,akun diretas orang lain pelaporan sudah x lebih tidak ada hasilnya ktp foto selfie sudah dicantumkan tapi selalu gagal,1,Negatif,2026-04-13 07:49:30
"Saya sudah capek sama ini aplikasi, pelayanan kurang, barang ditahan sampai 2 hingga 3 hari, di komplain jawabnya muter-muter, estimasi diganti seenak jidatnya, di kasih masukan malah makin parah setelah itu yg terjadi. udah, pindah toko sebelah saja. udah ngk bener ini aplikasi.",saya sudah capek sama ini aplikasi pelayanan kurang barang ditahan sampai hingga hari di komplain jawabnya muter muter estimasi diganti seenak jidatnya di kasih masukan malah makin parah setelah itu yg terjadi udah pindah toko sebelah saja udah ngk bener ini aplikasi,saya sudah capek sama ini aplikasi pelayanan kurang barang ditahan sampai hingga hari di komplain jawabnya muter muter estimasi diganti seenak jidatnya di kasih masukan malah makin buruk sekali setelah itu yg terjadi sudah pindah toko sebelah saja sudah ngk bener ini aplikasi,1,Negatif,2026-04-13 07:48:29
baguss suka .,baguss suka,baguss suka,5,Positif,2026-04-13 07:42:54
"sangat tidak nyaman dengan layanan kurir,, alamat sudah tertera disitu baloi center taman baloi lubuk baja.si kurir antar ke center park batam center sampai 3 kurir dgn alasan yg sm,sy ud ksh tau pdhl itu daerah nagoya masi aj antar ke batam center dgn kurir yg beda,terakhir kurir ke 4 dtg ud di alamat yg bnr krna sy uda kecewa tggu di hari ke 4 br kurir ny dtg di alamat itu sy ud blg cancel sblm dia tiba ,,malah yg dtg beda kurir🫡mnt chat cancel sy blg td ud chat loh.dtg lagi kurir lain antr",sangat tidak nyaman dengan layanan kurir alamat sudah tertera disitu baloi center taman baloi lubuk baja si kurir antar ke center park batam center sampai kurir dgn alasan yg sm sy ud ksh tau pdhl itu daerah nagoya masi aj antar ke batam center dgn kurir yg beda terakhir kurir ke dtg ud di alamat yg bnr krna sy uda kecewa tggu di hari ke br kurir ny dtg di alamat itu sy ud blg cancel sblm dia tiba malah yg dtg beda kurir mnt chat cancel sy blg td ud chat loh dtg lagi kurir lain antr,sangat tidak nyaman dengan layanan kurir alamat sudah tertera disitu baloi center taman baloi lubuk baja si kurir antar ke center park batam center sampai kurir dengan alasan yg sama sy ud ksh tau pdhl itu daerah nagoya masi saja antar ke batam center dengan kurir yg beda terakhir kurir ke dtg ud di alamat yg bnr karena sy uda kecewa tggu di hari ke br kurir ny dtg di alamat itu sy ud blg cancel sblm dia tiba malah yg dtg beda kurir mnt chat cancel sy blg td ud chat loh dtg lagi kurir lain antr,1,Negatif,2026-04-13 07:41:45
"iklan gila,,roas sekitar 20 an masih kena biaya per klik hampir 2k lebih,malah pernah 1 klik 10k ,,udah tiap hari habis banyak itu pun ngga ada pembeli buang"" duit😅",iklan gila roas sekitar an masih kena biaya per klik hampir k lebih malah pernah klik k udah tiap hari habis banyak itu pun ngga ada pembeli buang duit,iklan gila roas sekitar an masih kena biaya per klik hampir k lebih malah pernah klik k sudah tiap hari habis banyak itu pun tidak ada pembeli buang duit,2,Negatif,2026-04-13 07:36:12
pengiriman cepat,pengiriman cepat,pengiriman cepat,5,Positif,2026-04-13 07:34:07
"saya KECEWA DENGAN SHOPE Dri KMRIN SAYA AJUKAN RETURN KARNA BARANG KEBESARAN MALAH DI TOLAKIN TERUS DEMUA oleh shoope, knapa skrng shope BEGINI main tolak² sebelah pihak, BEGINI PELAYANAN SHOPE SKARANG BIKIN RIBET. LAMA² KAPOK BLANJA DI SHOPE, BENER² KCEWA BARANG GABISA DI RETURN GARA² DI TOLAKIN SHOPE TERUS KLO UDH KYK GINI SIAPA YG TGG JWB.",saya kecewa dengan shope dri kmrin saya ajukan return karna barang kebesaran malah di tolakin terus demua oleh shoope knapa skrng shope begini main tolak sebelah pihak begini pelayanan shope skarang bikin ribet lama kapok blanja di shope bener kcewa barang gabisa di return gara di tolakin shope terus klo udh kyk gini siapa yg tgg jwb,saya kecewa dengan shope dri kmrin saya ajukan return karena barang kebesaran malah di tolakin terus demua oleh shoope knapa skrng shope begini main tolak sebelah pihak begini pelayanan shope skarang bikin rumit/tidak praktis lama kapok blanja di shope bener kcewa barang gabisa di return gara di tolakin shope terus kalau sudah kyk gini siapa yg tgg jwb,1,Negatif,2026-04-13 07:32:13
sangat bagus,sangat bagus,sangat bagus,5,Positif,2026-04-13 07:31:58
sangat bagus,sangat bagus,sangat bagus,5,Positif,2026-04-13 07:29:34
"sopi aneh gw mesen paket, ada tulisan anda telah mengunakan kode promo akun anda dapat diblokir",sopi aneh gw mesen paket ada tulisan anda telah mengunakan kode promo akun anda dapat diblokir,sopi aneh gw mesen paket ada tulisan anda telah mengunakan kode promosi/diskon akun anda dapat diblokir,1,Negatif,2026-04-13 07:28:05
sgt membantu,sgt membantu,sgt membantu,5,Positif,2026-04-13 07:26:02
"aplikasi shopee sekarang berat lemot banget padahal udah di update gak kayak dulu, sekarang mau buka aplikasinya suka lamaaa..kadang ngeblang putih doang, mau memuat halaman juga sama lama terkadang keluar sendiri dari aplikasinya, padahal kecepatan jaringan saya bagus tembus sampai 1.1MB, udah coba beberapa kali terus begitu, padahal udah clear cache tolong diperbaiki lagi",aplikasi shopee sekarang berat lemot banget padahal udah di update gak kayak dulu sekarang mau buka aplikasinya suka lamaaa kadang ngeblang putih doang mau memuat halaman juga sama lama terkadang keluar sendiri dari aplikasinya padahal kecepatan jaringan saya bagus tembus sampai mb udah coba beberapa kali terus begitu padahal udah clear cache tolong diperbaiki lagi,aplikasi shopee sekarang berat lambat (aplikasi) banget padahal sudah di update tidak kayak dulu sekarang mau buka aplikasinya suka lamaaa kadang ngeblang putih saja mau memuat halaman juga sama lama terkadang keluar sendiri dari aplikasinya padahal kecepatan jaringan saya bagus tembus sampai mb sudah coba beberapa kali terus begitu padahal sudah clear cache tolong diperbaiki lagi,4,Positif,2026-04-13 07:25:28
oengiriman spx lama,oengiriman spx lama,oengiriman spx lama,1,Negatif,2026-04-13 07:24:23
mantul,mantul,mantap betul (sangat bagus),5,Positif,2026-04-13 07:20:34
"cukup puas, cukup membantu",cukup puas cukup membantu,cukup puas cukup membantu,5,Positif,2026-04-13 07:16:41
Oke nice,oke nice,oke nice,5,Positif,2026-04-13 07:15:30
Suka sekali,suka sekali,suka sekali,5,Positif,2026-04-13 07:12:36
shopee is the best,shopee is the best,shopee is the best,5,Positif,2026-04-13 07:12:20
"udah besti sama kurir meskipun pengiriman agak lama gpp lah, tapi kalo bisa lebih cepat lebih baik",udah besti sama kurir meskipun pengiriman agak lama gpp lah tapi kalo bisa lebih cepat lebih baik,sudah besti sama kurir meskipun pengiriman agak lama gpp lah tapi kalau bisa lebih cepat lebih baik,5,Positif,2026-04-13 07:11:58
"hidup cuma sebentar, kemungkinan batrenya CPT abis",hidup cuma sebentar kemungkinan batrenya cpt abis,hidup cuma sebentar kemungkinan batrenya cpt abis,5,Positif,2026-04-13 07:09:21
shopee sangat membatu untuk menemukan barang-barang yang tidak ada atau pun yang belum tersedia di toko terdekat kita. terimakasih,shopee sangat membatu untuk menemukan barang barang yang tidak ada atau pun yang belum tersedia di toko terdekat kita terimakasih,shopee sangat membatu untuk menemukan barang barang yang tidak ada atau pun yang belum tersedia di toko terdekat kita terimakasih,5,Positif,2026-04-13 07:09:05
"Ini aplikasi udh di upgrade tp malah gak bisa foto pesanan yg udh nyampe (harus video). upgrade sih malah bikin ribet, udh bener kayak sebelumnya foto + video, sekarang malah video doang buat pesanan yg udh nyampe. (13/04/26)",ini aplikasi udh di upgrade tp malah gak bisa foto pesanan yg udh nyampe harus video upgrade sih malah bikin ribet udh bener kayak sebelumnya foto video sekarang malah video doang buat pesanan yg udh nyampe,ini aplikasi sudah di upgrade tapi malah tidak bisa foto pesanan yg sudah nyampe harus video upgrade partikel penegas malah bikin rumit/tidak praktis sudah bener kayak sebelumnya foto video sekarang malah video saja untuk pesanan yg sudah nyampe,2,Negatif,2026-04-13 07:08:42
aplikasinya good sih tapi kurangin yang ada penipuannya ya?,aplikasinya good sih tapi kurangin yang ada penipuannya ya,aplikasinya good partikel penegas tapi kurangin yang ada penipuannya ya,5,Positif,2026-04-13 07:07:43
